{
  "$id": "https://schemas.apexops.dev/event-v1.json",
  "$schema": "https://json-schema.org/draft/2020-12/schema",
  "additionalProperties": false,
  "properties": {
    "eventId": {
      "minLength": 1,
      "type": "string"
    },
    "hash": {
      "pattern": "^[0-9a-f]{64}$",
      "type": "string"
    },
    "ownerEpoch": {
      "minimum": 1,
      "type": "integer"
    },
    "payload": {},
    "payloadHash": {
      "pattern": "^[0-9a-f]{64}$",
      "type": "string"
    },
    "previousHash": {
      "anyOf": [
        {
          "pattern": "^[0-9a-f]{64}$",
          "type": "string"
        },
        {
          "type": "null"
        }
      ]
    },
    "projectId": {
      "pattern": "^[a-z0-9]+(?:-[a-z0-9]+)*$",
      "type": "string"
    },
    "runId": {
      "pattern": "^[a-zA-Z0-9][a-zA-Z0-9_-]{0,127}$",
      "type": "string"
    },
    "schemaVersion": {
      "const": "1.0.0",
      "type": "string"
    },
    "sequence": {
      "minimum": 1,
      "type": "integer"
    },
    "timestamp": {
      "format": "date-time",
      "type": "string"
    },
    "type": {
      "minLength": 1,
      "type": "string"
    }
  },
  "required": [
    "schemaVersion",
    "eventId",
    "projectId",
    "runId",
    "sequence",
    "type",
    "timestamp",
    "ownerEpoch",
    "previousHash",
    "payloadHash",
    "payload",
    "hash"
  ],
  "type": "object"
}
