{"eventId":"43c12551-f467-48ba-8a67-d4916fb968f2","hash":"7400a5bb495d8e54d50ac7602f67359e4820c547920b287c872e6e97e80677e7","ownerEpoch":1,"payload":{"approvalHash":"c24e631a5b6964e24588c4397168e1fd85420b0448e62f5e11676286ed843652","gate":3,"transaction":{"after":{"createdAt":"2026-07-17T13:00:34.171Z","environment":"qualification","gates":[{"decidedAt":"2026-07-17T13:00:34.171Z","dependencyHash":"402bd53041ea5c3a0a81eb33d5586872b799a683ecc4c0098715957e5bd2d68b","gate":1,"state":"approved"},{"decidedAt":"2026-07-17T13:00:34.171Z","dependencyHash":"56cb45f20158150f2672cbc44f2537a9bad8aa8b7a051d18a0459df4d76aad94","gate":2,"state":"approved"},{"decidedAt":"2026-07-17T13:00:34.171Z","dependencyHash":"2cfcb343bf3981f45486ef08c820ea33d0fb762d1fc0cbf0b260f9962d97f8c6","gate":3,"state":"approved"},{"dependencyHash":"278bf267fd2da1a541646566102553573877e98b1e311f97cc1fc4c8e45e420e","gate":4,"state":"closed"}],"iacTool":"terraform","ownerEpoch":1,"projectId":"vnext-qualification","runId":"fe87ec79-0306-4820-9139-49e02d1ab254","runtimeLockHash":"278bf267fd2da1a541646566102553573877e98b1e311f97cc1fc4c8e45e420e","schemaVersion":"1.0.0","targetScope":"/subscriptions/00858ffc-dded-4f0f-8bbf-e17fff0d47d9/resourceGroups/rg-vnext-qualification-terraform"},"afterHash":"3ea52c1abb115c4911593ab55c5a9a7a71cce3eb22bd3da5c7b7da3a73979103"},"validatorIds":["gate:implementation-plan-ready"]},"payloadHash":"514fcaad9ed28a53fd4b7ab98467e8aac31670d4f27de7824702ff01e86515c7","previousHash":"615cb493e06bf5efc565125ff7e0aff57d28bcf55287dcb20f5671fccbeaa0a1","projectId":"vnext-qualification","runId":"fe87ec79-0306-4820-9139-49e02d1ab254","schemaVersion":"1.0.0","sequence":30,"timestamp":"2026-07-17T13:00:34.171Z","type":"gate.decided"}