{"eventId":"a89b417c-80d9-4f54-9303-bd7dc5ed9938","hash":"50de38fed34a2b5a911485b8d1d06f5679ba25c7578da4b3157cbe555fafb7b9","ownerEpoch":1,"payload":{"taskId":"97cc6a84-5c36-4332-bb82-8b72bcb642e4","taskType":"governance-review"},"payloadHash":"6e1fdcae321c1ea644ce4b7def804622b6b4a8c478c4ad050f9c82466d4c5d75","previousHash":"1449bd5fc834fc8255206c62b24ebdf2a042108e71f6bb99ca349282a15130ab","projectId":"vnext-qualification","runId":"1a2b4acf-2bdd-4f3c-a074-27e100701284","schemaVersion":"1.0.0","sequence":21,"timestamp":"2026-07-17T09:09:50.497Z","type":"task.issued"}