{"eventId":"f8aa2097-d918-40ce-bb6f-2443351c37a2","hash":"18af3ee87e8dea258eb50fc450690bf4eba6b9bc02cb2198abdb2249a010c6a0","ownerEpoch":1,"payload":{"dependencyHash":"bb7ec2c1cfe2e91b9ca68ea92e2255cc255ab55d50b1494bdc4154d4f109acd2","gate":1,"transaction":{"after":{"createdAt":"2026-07-17T12:40:12.751Z","environment":"qualification","gates":[{"dependencyHash":"bb7ec2c1cfe2e91b9ca68ea92e2255cc255ab55d50b1494bdc4154d4f109acd2","gate":1,"state":"open"},{"dependencyHash":"278bf267fd2da1a541646566102553573877e98b1e311f97cc1fc4c8e45e420e","gate":2,"state":"closed"},{"dependencyHash":"278bf267fd2da1a541646566102553573877e98b1e311f97cc1fc4c8e45e420e","gate":3,"state":"closed"},{"dependencyHash":"278bf267fd2da1a541646566102553573877e98b1e311f97cc1fc4c8e45e420e","gate":4,"state":"closed"}],"iacTool":"terraform","ownerEpoch":1,"projectId":"vnext-qualification","runId":"e84b9790-f2ad-4e26-a3da-d484c6760b16","runtimeLockHash":"278bf267fd2da1a541646566102553573877e98b1e311f97cc1fc4c8e45e420e","schemaVersion":"1.0.0","targetScope":"/subscriptions/00858ffc-dded-4f0f-8bbf-e17fff0d47d9/resourceGroups/rg-vnext-qualification-terraform"},"afterHash":"89aacfd9812720618a2f5cfa9fe93b48ac1f1d2ddb3859c1b991da1b7bdc7b6d"}},"payloadHash":"a5606f26af904b470358ee547ee0260783b51ecbdf08c06829a0b43633f11cbe","previousHash":"a9db3c26c7728f5621ec8721b8de735f9684edb2b6826a382483c577f4da5545","projectId":"vnext-qualification","runId":"e84b9790-f2ad-4e26-a3da-d484c6760b16","schemaVersion":"1.0.0","sequence":11,"timestamp":"2026-07-17T12:40:12.751Z","type":"gate.opened"}