{"eventId":"b39c6909-faeb-442d-877d-5d7496f3b2c2","hash":"e5f4aab03fc2991e6c0cd9192716350a24a58c0caa3cd81f24d07c96a4d8cd40","ownerEpoch":1,"payload":{"artifactHashes":{"governance-constraints":"c10ed41ec9a38c6f2775398435926f2fe30e3db5d1b7fcd6958977de47fd5c28"},"legacy":false,"nodeId":"governance-discovery","reviewBlockers":[],"taskId":"3b3d4f62-b9ef-4382-b0b6-1f1ca7e9afd1","validatorIds":["schema:governance-constraints-v1","business:governance-completeness","business:governance-freshness"]},"payloadHash":"2dd5d9e459863f9893c147c34eb8a509d710ad4f0ad2b94a814e4d739ff17e95","previousHash":"6e3f1d35afa4e37a2c29db043dc29376a41a7e6f76326c614a99a81880ac7eeb","projectId":"vnext-qualification","runId":"502deb2b-12b5-470b-85ad-a3ac6cf1b27f","schemaVersion":"1.0.0","sequence":18,"timestamp":"2026-07-17T11:05:41.765Z","type":"task.completed"}