{"eventId":"60a35805-867a-4b64-b184-b2d2ceaad3b0","hash":"7952c53a2270b57a91f2406f217ab73c0a9338e9fb14ae5d43e25d390271d028","ownerEpoch":1,"payload":{"artifactHashes":{"review-findings":"0354e70007df813035f313fb293ff85f47c0c989d44c7cb2d0c8fa493d7ea402"},"dependencyHash":"a971796f30ee096fb8a184a245bec5aab0769328dfa0da614ce94ccd4460970b","legacy":false,"nodeId":"plan-review","reviewBlockers":[],"reviewHash":"0354e70007df813035f313fb293ff85f47c0c989d44c7cb2d0c8fa493d7ea402","subjectHash":"a2664da691ee26fe3b2fceac40ec6d88ec821ecc0eb34039e1cf873b39d8af9c","taskId":"5ee95505-918a-4002-a2c4-826318d55d9f","validatorIds":["review:plan-comprehensive"]},"payloadHash":"0235edb430811ad1f3071a2cb0aa88f9235436c3d442081e090d629bf8da39e9","previousHash":"134d3dc068ea588d3eac718a4f6a57010a1a9e0acca75d2d374d7b859a831515","projectId":"vnext-qualification","runId":"cf6cd2ff-2a23-405c-bb84-71208c25184d","schemaVersion":"1.0.0","sequence":28,"timestamp":"2026-07-17T10:41:41.242Z","type":"task.completed"}