{"eventId":"ae7dc4a6-c639-4c3e-af39-42fad9bf0ea3","hash":"e888b81896d13adcabc9c01e17e80359262fb8307bcc212d640afbefd806484b","ownerEpoch":1,"payload":{"dependencyHash":"ca55fe3f0afe6e3a177a65e3df2b9d34fd20814c393111603b2826b3da77f5ef","gate":2,"transaction":{"after":{"createdAt":"2026-07-21T08:50:03.093Z","environment":"qualification","gates":[{"decidedAt":"2026-07-21T08:50:03.093Z","dependencyHash":"5c4c503f7b7773b3d200165fb7304c2128fe8f943133dd1df17b93f698d088d9","gate":1,"state":"approved"},{"dependencyHash":"ca55fe3f0afe6e3a177a65e3df2b9d34fd20814c393111603b2826b3da77f5ef","gate":2,"state":"open"},{"dependencyHash":"fb68a74873895c01faea6b67043f4abad51ee561e222e412471f1041fe2d63bf","gate":3,"state":"closed"},{"dependencyHash":"fb68a74873895c01faea6b67043f4abad51ee561e222e412471f1041fe2d63bf","gate":4,"state":"closed"}],"iacTool":"bicep","ownerEpoch":1,"projectId":"vnext-qualification","runId":"9b2251e0-3955-4199-a384-ee5942b3dc07","runtimeLockHash":"fb68a74873895c01faea6b67043f4abad51ee561e222e412471f1041fe2d63bf","schemaVersion":"1.0.0","targetScope":"/subscriptions/b47d2942-f5ad-4d3c-b28e-c23e4f83d97e/resourceGroups/rg-vnext-qualification-bicep"},"afterHash":"cad80547be17befb03b685d2236f8d8d0b0c01ebf52ff1f67c86783b63b6ab24"}},"payloadHash":"3988336d9614fb5cffbe836f8746041cbb495b2c6637b7517aa65aceff971213","previousHash":"c66d848dca02944a34871b488f5e879c55174d88618109906fd56d20397ea685","projectId":"vnext-qualification","runId":"9b2251e0-3955-4199-a384-ee5942b3dc07","schemaVersion":"1.0.0","sequence":23,"timestamp":"2026-07-21T08:50:03.093Z","type":"gate.opened"}