{"eventId":"9668f766-ea3d-44a1-89b2-51497d13c767","hash":"247665d1f917a35c151bcb6677427163ceefaa34789271bce770d8713e25b8c6","ownerEpoch":1,"payload":{"artifactHashes":{"architecture":"808cd91d2c726985d722eaf255a50cbd0fb62be45a5549747f1423e7add8492f","cost-estimate":"0e57022903d6882aa8b5fc0cd9c146453da065909c4bb020e7ad32446632dd6a"},"legacy":false,"nodeId":"architecture","reviewBlockers":[],"taskId":"f25635cf-ee53-4bde-9595-3af2d683d2fe","validatorEvidenceModes":{"business:availability-current":"native"},"validatorEvidenceRefs":{"business:availability-current":"582c5529668bf9ec41242c9efc08595380a979b8df28f864cd12ab4cfae4aeae"},"validatorIds":["schema:architecture-v1","business:requirements-traceability","business:cost-arithmetic","business:availability-current"]},"payloadHash":"324866947595eb85311563e0a8e828620348e5fcc2187bb8f72a9b7ba3e97350","previousHash":"f6505f6e1263c6081c015728c534c8708de6afc317fa78f526177a878481dc92","projectId":"vnext-qualification","runId":"fe87ec79-0306-4820-9139-49e02d1ab254","schemaVersion":"1.0.0","sequence":14,"timestamp":"2026-07-17T13:00:34.171Z","type":"task.completed"}