{"eventId":"8fc62fa2-f784-4edd-bb92-59815642b6a5","hash":"6673c7af648820c0aa2cb5cc6b01e45e7b43ecc0a158e73c70480a1a411dba92","ownerEpoch":1,"payload":{"approvalHash":"c492115681199868bad0d98db39c6947a12005a0568d0e21673c7c84ae2a5657","gate":4,"previewHash":"c1782b5428b1e9dd279a687a3cef6cd141f67407cb98709208220c1dc0fd048c","transaction":{"after":{"createdAt":"2026-07-21T08:50:03.093Z","environment":"qualification","gates":[{"decidedAt":"2026-07-21T08:50:03.093Z","dependencyHash":"5c4c503f7b7773b3d200165fb7304c2128fe8f943133dd1df17b93f698d088d9","gate":1,"state":"approved"},{"decidedAt":"2026-07-21T08:50:03.093Z","dependencyHash":"ca55fe3f0afe6e3a177a65e3df2b9d34fd20814c393111603b2826b3da77f5ef","gate":2,"state":"approved"},{"decidedAt":"2026-07-21T08:50:03.093Z","dependencyHash":"7fad9128854f2bdd1e0a650e472ba498b651b399009298cd42857f07e9c24c4c","gate":3,"state":"approved"},{"decidedAt":"2026-07-21T08:56:56.052Z","dependencyHash":"c1782b5428b1e9dd279a687a3cef6cd141f67407cb98709208220c1dc0fd048c","gate":4,"state":"approved"}],"iacTool":"bicep","ownerEpoch":1,"projectId":"vnext-qualification","runId":"9b2251e0-3955-4199-a384-ee5942b3dc07","runtimeLockHash":"fb68a74873895c01faea6b67043f4abad51ee561e222e412471f1041fe2d63bf","schemaVersion":"1.0.0","targetScope":"/subscriptions/b47d2942-f5ad-4d3c-b28e-c23e4f83d97e/resourceGroups/rg-vnext-qualification-bicep"},"afterHash":"3c780a823c95dbd5b53665e77f22254c4cf842e355c6bbcef560a5c43c3c9fbf"},"validatorIds":["gate:preview-current","gate:approval-binding-complete","gate:no-hard-blockers"]},"payloadHash":"6817ddd1c62b530efe4b44d6322a6a42cdc78fac7bd60c44c728951a3016d967","previousHash":"a6ee20e096ce4ebac51918d6515b8fe8f0440b802f0b82c28edf37ac8ccd44a4","projectId":"vnext-qualification","runId":"9b2251e0-3955-4199-a384-ee5942b3dc07","schemaVersion":"1.0.0","sequence":38,"timestamp":"2026-07-21T08:56:56.087Z","type":"gate.decided"}