{"eventId":"e751d74f-5fd0-4398-a6a5-33934afba890","hash":"0683b30e764c6a12c780a2114065a133cae6cf11bb724d65bdcbb5a8286af1b9","ownerEpoch":1,"payload":{"dependencyHash":"beba2c1e61021de01890f47d25410076c680e3e42e51dcfaba8048bf3c5e0b68","gate":1,"transaction":{"after":{"createdAt":"2026-07-17T09:09:50.497Z","environment":"qualification","gates":[{"dependencyHash":"beba2c1e61021de01890f47d25410076c680e3e42e51dcfaba8048bf3c5e0b68","gate":1,"state":"open"},{"dependencyHash":"278bf267fd2da1a541646566102553573877e98b1e311f97cc1fc4c8e45e420e","gate":2,"state":"closed"},{"dependencyHash":"278bf267fd2da1a541646566102553573877e98b1e311f97cc1fc4c8e45e420e","gate":3,"state":"closed"},{"dependencyHash":"278bf267fd2da1a541646566102553573877e98b1e311f97cc1fc4c8e45e420e","gate":4,"state":"closed"}],"iacTool":"bicep","ownerEpoch":1,"projectId":"vnext-qualification","runId":"1a2b4acf-2bdd-4f3c-a074-27e100701284","runtimeLockHash":"278bf267fd2da1a541646566102553573877e98b1e311f97cc1fc4c8e45e420e","schemaVersion":"1.0.0","targetScope":"/subscriptions/00858ffc-dded-4f0f-8bbf-e17fff0d47d9/resourceGroups/rg-vnext-qualification-bicep"},"afterHash":"9a6a0b83bc911d73b2f6f17e6c4fe14b8ab8cd5e3f695da8550ba3b87e7be4ec"}},"payloadHash":"7d3831bf5d31efed1ba21b273e076bfe18678d88e243f57d378df12a06796929","previousHash":"5dc1dac37d601d881d3756dc93c928171666a6b23f8116ca50dfe0399e25dc69","projectId":"vnext-qualification","runId":"1a2b4acf-2bdd-4f3c-a074-27e100701284","schemaVersion":"1.0.0","sequence":11,"timestamp":"2026-07-17T09:09:50.497Z","type":"gate.opened"}