{"eventId":"4e70ef10-71df-4e70-8a89-f2af3666f4ed","hash":"89fec715f5f7610e9ed74895663cc4b1074942bdfbc61d65da5d8f8049ff95d6","ownerEpoch":1,"payload":{"artifactHashes":{"iac-handoff":"f559d836930eed5a96957e0df8985c84c1fe67726cef05251c1d595b4a43af9a","logical-resource-manifest":"1ddd2d235b6999abf080c9040b7106a3ec6f2cf7edb36aa310a2c7a21582be76"},"legacy":false,"nodeId":"codegen-bicep","reviewBlockers":[],"taskId":"548d0593-da13-42ae-b023-5bf8f354248c","validatorIds":["business:bicep-binding-coverage"]},"payloadHash":"e2299681fd245d3f6ff2e2fa876985772e16c0941c03e4d35251c9b70308c9b5","previousHash":"ddb4de29c0f16cc101836e1dd43e128df3bc5a05203a42b6466a3178a3e51ad1","projectId":"vnext-qualification","runId":"e16098e7-87fb-44f0-83e6-91af0de41e21","schemaVersion":"1.0.0","sequence":32,"timestamp":"2026-07-20T14:22:39.799Z","type":"task.completed"}