{"eventId":"b8c6b0a6-beca-40cc-bba9-3071005fff0e","hash":"d71d86d75063d62dc9a271f31f131f5a16c1a0325ffc19fb14361d7ae2e0c2f8","ownerEpoch":1,"payload":{"artifactHashes":{"architecture":"dd78391acbf8685b9892040bafc39054965bb07539327e8ae6c53946490c456c","cost-estimate":"29463ea9673c4391c395456292f04f231cc78849d27d782a794c06d236d2e373"},"legacy":false,"nodeId":"architecture","reviewBlockers":[],"taskId":"4fa49ecb-b324-4871-9135-0f0927e59c38","validatorEvidenceModes":{"business:availability-current":"native"},"validatorEvidenceRefs":{"business:availability-current":"4db1c3c2b368f8a92f446466addda0d4edabbe1797f95de417f767ee8f1cb3df"},"validatorIds":["schema:architecture-v1","business:requirements-traceability","business:cost-arithmetic","business:availability-current"]},"payloadHash":"1f834e93f5921235cc8469587d77fa0bd8edd3542a5f724136d41d59c4903082","previousHash":"74cdbc9464ecdee892f1d195c55409e2a6292ac3db7fcc1fb345c4b5938e7475","projectId":"vnext-qualification","runId":"9ab065a3-281a-4751-9396-75b5d036b19b","schemaVersion":"1.0.0","sequence":14,"timestamp":"2026-07-17T10:30:10.379Z","type":"task.completed"}