{"eventId":"73d38309-c132-49e4-b198-08ad4e3857ac","hash":"add3d46df6bbe8232735917b921d858af4428f63d7e8e1042220735dc1a83cb7","ownerEpoch":1,"payload":{"artifactHashes":{"environment-inputs":"5afa0d003d84223d254b6b2675ce5664d5641eed7ff23ed5a85e313dfffe04ae","iac-binding":"32fbf47fdbf59fcaa8eec202a7cb4b479fe6d43ffb8e058ed4a47d2e89db6099","implementation-intent":"73bf5acc50894d885cfa4505ca5c89daa17f5382ba09aee523385e74962c0b10"},"legacy":false,"nodeId":"plan","reviewBlockers":[],"taskId":"4e37a4fd-485c-41be-b32d-72e2ecfd60f0","validatorIds":["schema:implementation-intent-v1","schema:iac-binding-v1","business:plan-source-coverage","business:binding-track-match","business:dependency-acyclic"]},"payloadHash":"ac6709496dec6ccf0d58638e765e8d0c29c717461c91987f03f4779608c95e4f","previousHash":"a396031dfb1dcfb48b00076b7709c32ce9957a0bc353297999073b9b6687bdad","projectId":"vnext-qualification","runId":"e16098e7-87fb-44f0-83e6-91af0de41e21","schemaVersion":"1.0.0","sequence":26,"timestamp":"2026-07-20T14:22:39.799Z","type":"task.completed"}