{"eventId":"a4900dd5-5ca2-4f82-9b6a-565af6428ff7","hash":"735265e953bcd09cfbc9fc08d5e4c4172cfd07034f4a41ef445e8d84421a47ee","ownerEpoch":1,"payload":{"taskId":"4745792e-c3b9-419d-be0a-c27586f0b7a9","taskType":"codegen-terraform"},"payloadHash":"ce2d1439c44ffac6d41b12983d54c3becaf5069306a8776bcdc5d48f3765ece9","previousHash":"ed12ffecd185824d968ec68745661e53f452c3f6f7d80d967fc23805ca44838c","projectId":"vnext-qualification","runId":"5f2006d4-e722-4749-8eca-b67a0cbc05c3","schemaVersion":"1.0.0","sequence":31,"timestamp":"2026-07-21T09:38:50.073Z","type":"task.issued"}