{"eventId":"053ec5a7-b9ba-4aa4-b198-cecad9baa493","hash":"89fedc3a59ff572977f68b8eda20b4c4da89c8c1d080313999b7fdac0ea15288","ownerEpoch":1,"payload":{"artifactHashes":{"architecture":"96bd255b68a1c941df3229057bf921d7338b48bb1d676ecf9eee0f24554604c9","cost-estimate":"e7bd4b98a22e73ba21135b08eeb88bc5cdf945f70df28d0e6805f3936171dad7"},"legacy":false,"nodeId":"architecture","reviewBlockers":[],"taskId":"43b234c0-cf6d-4dcc-bd4a-5a015db8d97f","validatorEvidenceModes":{"business:availability-current":"native"},"validatorEvidenceRefs":{"business:availability-current":"8f3409394045a71207aef1051d5b7826ca5e401e9c5d44fb8f1d801a05ab6544"},"validatorIds":["schema:architecture-v1","business:requirements-traceability","business:cost-arithmetic","business:availability-current"]},"payloadHash":"a5699c7790830d9475e3a3afdd5623ab1ae532b174ef579350424c75aa60715f","previousHash":"e9ae10b6294e285dbbdcf95be068c4b822ad33d6cdb1d9d388fc7c55d6ef7f1e","projectId":"vnext-qualification","runId":"cf6cd2ff-2a23-405c-bb84-71208c25184d","schemaVersion":"1.0.0","sequence":14,"timestamp":"2026-07-17T10:41:41.242Z","type":"task.completed"}