{"eventId":"76fa3839-0f9a-4a6a-a2cf-ffb48a665e4d","hash":"e30b9b4f64bae91a48b39604c18092540f5eaba60da3382650b66aa67c5a5e07","ownerEpoch":2,"payload":{"approvalHash":"07eed4b831750eb437526341430e09d8de5c318cea32af66251157bf882f33e7","executionEvidence":{"mode":"native","operationId":"b364e942-215f-4eec-951a-032dc5ee0e6c","previewHash":"309cc8248093f1e1433e61813e82360364ad788b2b05dcaba2fb3ea858391c39","validatorIds":["deploy:exact-saved-plan","deploy:state-lineage-and-serial"]},"operation":{"approvalHash":"07eed4b831750eb437526341430e09d8de5c318cea32af66251157bf882f33e7","operation":"apply","operationId":"b364e942-215f-4eec-951a-032dc5ee0e6c","ownerEpoch":2,"previewHash":"309cc8248093f1e1433e61813e82360364ad788b2b05dcaba2fb3ea858391c39","projectId":"vnext-qualification","providerOperationId":"terraform-plan:0bd15cea5f155f2c6ac38f41d995a667363e0c2c17d830d4d959106dabe69400","runId":"5f2006d4-e722-4749-8eca-b67a0cbc05c3","schemaVersion":"1.0.0","state":"succeeded","updatedAt":"2026-07-21T10:09:04.692Z"},"preValidatorIds":["deploy:exact-approved-operation","deploy:stale-writer-rejection"],"previewHash":"309cc8248093f1e1433e61813e82360364ad788b2b05dcaba2fb3ea858391c39","provider":"terraform"},"payloadHash":"bfc28abe5ac64f3afc0c1c428a4c54f422202c93091974b7811497830b1da87a","previousHash":"0241c3893eff9c9b96c8def675bcf9d1774a1513f4d45c78a39d241c05ba67de","projectId":"vnext-qualification","runId":"5f2006d4-e722-4749-8eca-b67a0cbc05c3","schemaVersion":"1.0.0","sequence":41,"timestamp":"2026-07-21T10:09:04.696Z","type":"deployment.executed"}