{"eventId":"36dfd734-9818-4707-bce8-10b26610bc42","hash":"07d70857943fda148d15cad0d9e9c5e1d2519115b020c29dda2d56b80f56803d","ownerEpoch":1,"payload":{"artifactHashes":{"policy-property-map":"04ac5c31fc6505ba52e1f350d855d77d7e9ecdb12b63a0f8eeb4cbcf93fb4f6d"},"legacy":false,"nodeId":"governance-reconciliation","reviewBlockers":[],"taskId":"79c72aca-334d-4ff1-9364-f8cd71564da8","validatorIds":["schema:policy-property-map-v1","business:policy-effect-coverage"]},"payloadHash":"fc3fa65cb66a9e78510730d4b3b2fff8684bed3b089f2a0aceeea18e3ab53be8","previousHash":"a686d8bcb8442db93acd338224f7944af2ad623f77a4f87e97fb75b4f2379efa","projectId":"vnext-qualification","runId":"cf6cd2ff-2a23-405c-bb84-71208c25184d","schemaVersion":"1.0.0","sequence":20,"timestamp":"2026-07-17T10:41:41.242Z","type":"task.completed"}