{"eventId":"ae6b6526-2f97-4ba7-b067-f916ad2cead1","hash":"48b279d06701a8ccb20f3bcb85583009863e3e6ac3495ad2ed97e1d376e12208","ownerEpoch":4,"payload":{"claimHash":"c816aa546ec7a1157cfe92909c66a3cb2fd772362e76d99d654dc56d7ce74629","recipient":"local:9fb4574d-5cc0-4e23-9ccc-179303cdbf6a"},"payloadHash":"7894d11d2adb0bd46dc72718318fbc8779e37597bb158fd500caa2fb5110e918","previousHash":"44abee2bb96c1907a2f9b80d151f9d63bfd2d692cd515354b7d5fb54a77e961a","projectId":"vnext-qualification","runId":"9b2251e0-3955-4199-a384-ee5942b3dc07","schemaVersion":"1.0.0","sequence":53,"timestamp":"2026-07-21T09:18:31.624Z","type":"transfer-requested"}