{"eventId":"3144fe2c-a6b0-4b3d-b876-bdb422c16939","hash":"74001c53e08da3fa34185b42a6e5b9c54cb29c4175a41e1ee312bf1860eb012b","ownerEpoch":1,"payload":{"artifactHashes":{"review-findings":"87b3443e538aeadd4185cd0ad7c055c21e8672816ff38cc8662653b0fd262426"},"dependencyHash":"e08a57956041fa8fba0ac4b25f530d9ad8abcf5fbc44c5dcd3888bf5a82f4086","legacy":false,"nodeId":"governance-review","reviewBlockers":[],"reviewHash":"87b3443e538aeadd4185cd0ad7c055c21e8672816ff38cc8662653b0fd262426","subjectHash":"8012d38a61af0484a3d03916d4f6eb7fba17e440dc4eb9b46fb7e926050efdea","taskId":"97cc6a84-5c36-4332-bb82-8b72bcb642e4","validatorIds":["review:governance-reconciliation"]},"payloadHash":"57525a07249fac7502d79b0f419244f05316e5a302d99e3594bd49723c0f436d","previousHash":"50de38fed34a2b5a911485b8d1d06f5679ba25c7578da4b3157cbe555fafb7b9","projectId":"vnext-qualification","runId":"1a2b4acf-2bdd-4f3c-a074-27e100701284","schemaVersion":"1.0.0","sequence":22,"timestamp":"2026-07-17T09:09:50.497Z","type":"task.completed"}