{"eventId":"fd681719-7a62-442f-88ef-02f31fbdd7dc","hash":"dc302f9b76fad0c192a4a384b832a41d667ca8113f83f516de8b05ccba252242","ownerEpoch":1,"payload":{"runtimeLockHash":"278bf267fd2da1a541646566102553573877e98b1e311f97cc1fc4c8e45e420e"},"payloadHash":"a22193182aa4520f77367020d3ec8e74b50b13a6e08fa1c74792f87564645217","previousHash":null,"projectId":"vnext-qualification","runId":"fe87ec79-0306-4820-9139-49e02d1ab254","schemaVersion":"1.0.0","sequence":1,"timestamp":"2026-07-17T13:00:34.171Z","type":"workspace.initialized"}