{"eventId":"698a2aa8-269f-49c7-a2b0-6e3b871b060c","hash":"036b57ae49930c71e309043a8ee9b088e81641be12bc12043fc20b16745f8ab7","ownerEpoch":1,"payload":{"artifactHashes":{"policy-property-map":"8e0a8ae265e315a1488c696c736e634634d7784c4fe6c78efc02f199a6166a17"},"legacy":false,"nodeId":"governance-reconciliation","reviewBlockers":[],"taskId":"e0a413cd-83e1-4c64-a141-59c3d00ff5c2","validatorIds":["schema:policy-property-map-v1","business:policy-effect-coverage"]},"payloadHash":"7245a8a4e45aaa9b1f9cc9a2f935f7b2ebbcca37f35b60a74539e551e98d5e94","previousHash":"2009d0c19b0823ff16e3ba47e064b94d0d89933d135639bcdfd5199a1b5b835c","projectId":"vnext-qualification","runId":"5f2006d4-e722-4749-8eca-b67a0cbc05c3","schemaVersion":"1.0.0","sequence":20,"timestamp":"2026-07-21T09:38:50.073Z","type":"task.completed"}