{"eventId":"2faaf49d-1150-4b1b-a020-137b315e1e2f","hash":"45dd6b93a4c5944269531ab5b791c0fa5be312fd3dabb18995e65debbf501a9e","ownerEpoch":1,"payload":{"bytes":86,"contentType":"application/json","hash":"7a1842deb61821b0d981611e1ca9d75f323b893b674caf55b9c32a6fb7004414","kind":"regional-availability-evidence","status":"accepted"},"payloadHash":"e12e361a1a08ec03db95b250e933fce5acf8a396f63a59a543aecb313bef76a4","previousHash":"6b6627a0e14cdf2fa5092f044424ea4549bce8bd8900badd69fcf646d12a846b","projectId":"vnext-qualification","runId":"cf6cd2ff-2a23-405c-bb84-71208c25184d","schemaVersion":"1.0.0","sequence":5,"timestamp":"2026-07-17T10:41:41.242Z","type":"evidence.accepted"}