{"eventId":"f5bc8b91-458f-4c63-8d69-972bad10d805","hash":"f8d7b1136debae4ed7198e44d2e1e47e4c24a1cb68272cb1a155886942e1fe94","ownerEpoch":1,"payload":{"taskId":"1ed1c6c7-475d-4d35-9c7c-e33d3084f764","taskType":"governance-discovery"},"payloadHash":"714c9f164efd76852cbb0fcfe541878c048ce3519f2908b8a44f22f2bb7a07a2","previousHash":"70888764a46a42b8b8c5fd113b99664ee162b395515fbd4d97b0cb41e5304a43","projectId":"vnext-qualification","runId":"e16098e7-87fb-44f0-83e6-91af0de41e21","schemaVersion":"1.0.0","sequence":17,"timestamp":"2026-07-20T14:22:39.799Z","type":"task.issued"}