{"eventId":"714cd509-42cf-4d58-b01a-e01775d9b4f6","hash":"07dce2203bdf583315cc7223ad7769a75781e105ecc317e99e83ebd5a990c76b","ownerEpoch":1,"payload":{"artifactHashes":{"environment-inputs":"5afa0d003d84223d254b6b2675ce5664d5641eed7ff23ed5a85e313dfffe04ae","iac-binding":"32fbf47fdbf59fcaa8eec202a7cb4b479fe6d43ffb8e058ed4a47d2e89db6099","implementation-intent":"73bf5acc50894d885cfa4505ca5c89daa17f5382ba09aee523385e74962c0b10"},"inherited":true,"inheritedEventHash":"add3d46df6bbe8232735917b921d858af4428f63d7e8e1042220735dc1a83cb7","inheritedFromRunId":"e16098e7-87fb-44f0-83e6-91af0de41e21","legacy":false,"nodeId":"plan","reviewBlockers":[],"taskId":"4e37a4fd-485c-41be-b32d-72e2ecfd60f0","validatorIds":["schema:implementation-intent-v1","schema:iac-binding-v1","business:plan-source-coverage","business:binding-track-match","business:dependency-acyclic"]},"payloadHash":"0b288be3be36ed8d57dd8ae17a2cf5f69713555b112564ca60124dd8a29ec234","previousHash":"27b4f51c459a2795baede04d7bb72a3ce36bd202a82db890102399411ed62e4f","projectId":"vnext-qualification","runId":"7782d292-3d4e-459c-a3ac-6ffa429dbf24","schemaVersion":"1.0.0","sequence":8,"timestamp":"2026-07-21T08:26:59.363Z","type":"task.completed"}