{"eventId":"f864c2ac-705e-4569-9d81-57cb93093ef0","hash":"789a60762e815bee84c9941b9c402505700f1f496afd2c050b7148513a75bdbf","ownerEpoch":1,"payload":{"dependencyHash":"4f41e2f612c33b29b5a120c8696abfddf9fb4fb55085d8818c600dd2039d4bf5","gate":2,"transaction":{"after":{"createdAt":"2026-07-17T13:14:30.195Z","environment":"qualification","gates":[{"decidedAt":"2026-07-17T13:14:30.195Z","dependencyHash":"fe83a11918bb2ef806170f040cb287a95eee5a5d188bcf071df62c647a66b517","gate":1,"state":"approved"},{"dependencyHash":"4f41e2f612c33b29b5a120c8696abfddf9fb4fb55085d8818c600dd2039d4bf5","gate":2,"state":"open"},{"dependencyHash":"278bf267fd2da1a541646566102553573877e98b1e311f97cc1fc4c8e45e420e","gate":3,"state":"closed"},{"dependencyHash":"278bf267fd2da1a541646566102553573877e98b1e311f97cc1fc4c8e45e420e","gate":4,"state":"closed"}],"iacTool":"terraform","ownerEpoch":1,"projectId":"vnext-qualification","runId":"c332a96d-925c-4af2-aac6-91ffd26f4d5a","runtimeLockHash":"278bf267fd2da1a541646566102553573877e98b1e311f97cc1fc4c8e45e420e","schemaVersion":"1.0.0","targetScope":"/subscriptions/00858ffc-dded-4f0f-8bbf-e17fff0d47d9/resourceGroups/rg-vnext-qualification-terraform"},"afterHash":"574cbe258f734ccceab1e87e4d1a79fa1c7d5bd6a567a6643881c4780e1c7ff0"}},"payloadHash":"0dc507596ce6e89ed32cdce7e8fe5eb52fb4ccc1fff82bac7919c37fa17b98a9","previousHash":"cae61138394f24c77b8e310c457754eac435f00b114ef9e78f01847f0b0d6c76","projectId":"vnext-qualification","runId":"c332a96d-925c-4af2-aac6-91ffd26f4d5a","schemaVersion":"1.0.0","sequence":23,"timestamp":"2026-07-17T13:14:30.195Z","type":"gate.opened"}